{
  "id": "jwglxt-usts-sample",
  "system": "jwglxt",
  "adapter": "jwglxt.js",
  "input": {
    "html": "<!doctype html><html><body><table id=\"kbtable\"><tr><td id=\"1-2\">高等数学<br>张伟 老师<br>A101</td><td id=\"1-4\">大学英语<br>李娜 老师<br>B203</td></tr></table></body></html>",
    "url": "https://jwgl.usts.edu.cn/jwglxt/xskb/query",
    "hints": {}
  },
  "expect": {
    "minEvents": 2,
    "events": [
      { "title": "高等数学", "dayOfWeek": 2, "periodStart": 1, "periodEnd": 2, "room": "A101", "teacher": "张伟", "weeks": [] },
      { "title": "大学英语", "dayOfWeek": 4, "periodStart": 1, "periodEnd": 2, "room": "B203", "teacher": "李娜", "weeks": [] }
    ]
  }
}
